Case Number and Title,Judge,Time,Courtroom,Purpose,Case Number,Title,Date
23-cr-0177:  USA v. LAMOND,Judge Amy B. Jackson,09:30AM,Courtroom 25A- In Person,Bench Trial,23-cr-0177,  USA v. LAMOND,2024-12-23
23-cr-0043:  USA v. MARTINEZ-MORA,Judge Trevor N. McFadden,10:00AM,Courtroom 2- In Person,Sentencing,23-cr-0043,  USA v. MARTINEZ-MORA,2024-12-23
23-cr-0043:  USA v. MARADIAGA,Judge Trevor N. McFadden,10:00AM,Courtroom 2- In Person,Plea Agreement Hearing,23-cr-0043,  USA v. MARADIAGA,2024-12-23
"22-cv-2837:  TRUST AGREEMENT OF STEVEN M. SUSHNER et al v. C.A. HARRISON COMPANIES, LLC et al",Mag. Judge Moxila A. Upadhyaya,10:30AM,Telephonic/VTC,Telephone Conference,22-cv-2837,"  TRUST AGREEMENT OF STEVEN M. SUSHNER et al v. C.A. HARRISON COMPANIES, LLC et al",2024-12-23
23-cr-0394:  USA v. BROWN,Judge Trevor N. McFadden,02:00PM,Courtroom 2- In Person,Plea Agreement Hearing,23-cr-0394,  USA v. BROWN,2024-12-23
