Case Number and Title,Judge,Time,Courtroom,Purpose,Case Number,Title,Date
21-cv-0400:  LEE et al v. TRUMP et al,Judge Amit P. Mehta,10:00AM,Telephonic/VTC,Status Conference,21-cv-0400,  LEE et al v. TRUMP et al,2026-01-05
25-cv-3560:  MELLEN v. SEED SCHOOL OF WASHINGTON DC,Judge Reggie B. Walton,10:00AM,Telephonic/VTC,Scheduling Conference,25-cv-3560,  MELLEN v. SEED SCHOOL OF WASHINGTON DC,2026-01-05
25-cr-0217:  USA v. SPEAKS,Judge John D. Bates,10:30AM,Courtroom 30A- In Person,Status Conference,25-cr-0217,  USA v. SPEAKS,2026-01-05
25-cr-0192:  USA v. LEGRO,Judge John D. Bates,11:00AM,Courtroom 30A- In Person,Status Conference,25-cr-0192,  USA v. LEGRO,2026-01-05
23-cr-0292:  USA v. GREEN,Judge Colleen Kollar-Kotelly,01:30PM,[Not Assigned],Plea Agreement Hearing,23-cr-0292,  USA v. GREEN,2026-01-05
20-cr-0029:  USA v. PRIDGEN,Mag. Judge Zia M. Faruqui,02:00PM,Telephonic/VTC,Status Conference,20-cr-0029,  USA v. PRIDGEN,2026-01-05
23-cr-0229:  USA v. TARANTO,Judge Carl J. Nichols,02:00PM,Telephonic/VTC,Preliminary Revocation Hearing,23-cr-0229,  USA v. TARANTO,2026-01-05
